<?xml version="1.0" encoding="UTF-8"?>
<transactions xmlns:xsi="http://www.w3.org/2001/XMLSchema-instance" xsi:noNamespaceSchemaLocation="transactions.xsd">
    <transaction>
        <date>2011-06-01</date>
        <amount>3000.0</amount>
        <type>PAYMENT</type>
    </transaction>
    <transaction>
        <date>2011-06-03</date>
        <amount>-500.0</amount>
        <type>BANKFEE</type>
    </transaction>    <transaction>
        <date>2011-06-05</date>
        <amount>2500.0</amount>
        <type>PAYMENT</type>
    </transaction>    
    <startBalance>5000.0</startBalance>
    <endBalance>10000.0</endBalance>
    <statementDate>2011-06-07</statementDate>
</transactions>
